{
  "schema_version": "0.1.0",
  "benchmark_version": "0.1.0",
  "corpus_id": "sha256:5e505148c7e9004a9c1ae7bd68c66addfc9ae3377be7e3057a81d7a1996649bd",
  "questions": [
    {
      "question_id": "Q01", "language": "en", "stratum": "direct",
      "question": "What are the six initial principles in NASA's ethical AI framework?",
      "operator_query": "Fair Explainable Transparent Accountable Secure Safe Human-Centric Societally Beneficial Scientifically Ethically Robust",
      "reference_answer": "Fair; Explainable and Transparent; Accountable; Secure and Safe; Human-Centric and Societally Beneficial; Scientifically and Ethically Robust.",
      "answerable": true, "temporal_scope": "historical_document", "required_formats": ["pdf"],
      "required_sources": ["nasa-ethical-ai-framework"], "acceptable_sources": ["nasa-ethical-ai-framework"],
      "support_atoms": [
        {"atom_id": "A01", "source_key": "nasa-ethical-ai-framework", "variants": ["Fair. AI systems must include considerations regarding how to treat people"], "required": true},
        {"atom_id": "A02", "source_key": "nasa-ethical-ai-framework", "variants": ["Explainable and Transparent. Solutions must clearly state if, when, and how an AI system is involved"], "required": true},
        {"atom_id": "A03", "source_key": "nasa-ethical-ai-framework", "variants": ["Accountable. Organizations and individuals must be accountable for the systems they create"], "required": true},
        {"atom_id": "A04", "source_key": "nasa-ethical-ai-framework", "variants": ["Secure and Safe. AI systems must respect privacy and do no harm"], "required": true},
        {"atom_id": "A05", "source_key": "nasa-ethical-ai-framework", "variants": ["Human-Centric and Societally Beneficial. AI systems must obey human legal systems"], "required": true},
        {"atom_id": "A06", "source_key": "nasa-ethical-ai-framework", "variants": ["AI systems must be Scientifically and Ethically Robust"], "required": true}
      ],
      "source_fitness": [{"source_key": "nasa-ethical-ai-framework", "publisher_authority": 2, "directness": 2, "temporal_fit": 2, "integrity": 2, "reuse_basis": 2, "rationale": "Exact NASA NTRS technical memorandum containing the declared framework."}]
    },
    {
      "question_id": "Q02", "language": "en", "stratum": "paraphrase",
      "question": "Who should keep ultimate control of machine decisions for the foreseeable future?",
      "operator_query": "humans must remain in charge foreseeable future",
      "reference_answer": "Humans must remain in charge for the foreseeable future.",
      "answerable": true, "temporal_scope": "historical_document", "required_formats": ["pdf"],
      "required_sources": ["nasa-ethical-ai-framework"], "acceptable_sources": ["nasa-ethical-ai-framework"],
      "support_atoms": [{"atom_id": "A01", "source_key": "nasa-ethical-ai-framework", "variants": ["humans must remain in charge, which this group sees as especially valuable for NASA's employment of AI for the foreseeable future"], "required": true}],
      "source_fitness": [{"source_key": "nasa-ethical-ai-framework", "publisher_authority": 2, "directness": 2, "temporal_fit": 2, "integrity": 2, "reuse_basis": 2, "rationale": "Exact NASA document directly states the retained-control requirement."}]
    },
    {
      "question_id": "Q03", "language": "en", "stratum": "source_discrimination",
      "question": "Which external framework did NASA use as its ethical-AI baseline, and why was it chosen?",
      "operator_query": "selected Gartner framework baseline generalized well avoided overlap succinctly map NASA needs",
      "reference_answer": "NASA selected Gartner because its elements generalized well, avoided overlap and mapped succinctly to NASA's needs.",
      "answerable": true, "temporal_scope": "historical_document", "required_formats": ["pdf"],
      "required_sources": ["nasa-ethical-ai-framework"], "acceptable_sources": ["nasa-ethical-ai-framework"],
      "support_atoms": [
        {"atom_id": "A01", "source_key": "nasa-ethical-ai-framework", "variants": ["We selected the Gartner framework as our baseline"], "required": true},
        {"atom_id": "A02", "source_key": "nasa-ethical-ai-framework", "variants": ["because its elements generalized well, avoided overlap among themselves, and could succinctly map to NASA's needs"], "required": true}
      ],
      "source_fitness": [{"source_key": "nasa-ethical-ai-framework", "publisher_authority": 2, "directness": 2, "temporal_fit": 2, "integrity": 2, "reuse_basis": 2, "rationale": "The NASA authors directly document their baseline selection."}]
    },
    {
      "question_id": "Q04", "language": "de", "stratum": "cross_language",
      "question": "Welches zusätzliche NASA-spezifische Robustheitsprinzip ergänzt den übernommenen Rahmen?",
      "operator_query": "NASA-specific principle Scientifically Ethically Robust scientific method tested documented peer reviewed",
      "reference_answer": "Scientifically and Ethically Robust.",
      "answerable": true, "temporal_scope": "historical_document", "required_formats": ["pdf"],
      "required_sources": ["nasa-ethical-ai-framework"], "acceptable_sources": ["nasa-ethical-ai-framework"],
      "support_atoms": [{"atom_id": "A01", "source_key": "nasa-ethical-ai-framework", "variants": ["we add a NASA-specific principle: AI systems must be Scientifically and Ethically Robust"], "required": true}],
      "source_fitness": [{"source_key": "nasa-ethical-ai-framework", "publisher_authority": 2, "directness": 2, "temporal_fit": 2, "integrity": 2, "reuse_basis": 2, "rationale": "Exact NASA source for the NASA-specific addition."}]
    },
    {
      "question_id": "Q05", "language": "en", "stratum": "direct",
      "question": "Which five workshop test cases were identified as the best?",
      "operator_query": "best test cases selecting Decadal Survey priorities unidentified science topics label discoverability observation capabilities proposal reviewers advisory committees",
      "reference_answer": "Decadal Survey priorities; new science topics; literature/proposal labelling and discoverability; observation capabilities; and bias mitigation in reviewer/advisory membership selection.",
      "answerable": true, "temporal_scope": "historical_document", "required_formats": ["docx"],
      "required_sources": ["nasa-ai-strategic-planning-workshop"], "acceptable_sources": ["nasa-ai-strategic-planning-workshop"],
      "support_atoms": [
        {"atom_id": "A01", "source_key": "nasa-ai-strategic-planning-workshop", "variants": ["Use of AI to assist in selecting Decadal Survey priorities"], "required": true},
        {"atom_id": "A02", "source_key": "nasa-ai-strategic-planning-workshop", "variants": ["Use of AI to identify new, or previously unidentified, science topics for prioritization"], "required": true},
        {"atom_id": "A03", "source_key": "nasa-ai-strategic-planning-workshop", "variants": ["Using AI to better label and increase discoverability of scientific literature and proposals"], "required": true},
        {"atom_id": "A04", "source_key": "nasa-ai-strategic-planning-workshop", "variants": ["Use of AI to enhance current observation capabilities for scientific missions"], "required": true},
        {"atom_id": "A05", "source_key": "nasa-ai-strategic-planning-workshop", "variants": ["Using AI to mitigate biases in selection of proposal reviewers and membership of advisory committees"], "required": true}
      ],
      "source_fitness": [{"source_key": "nasa-ai-strategic-planning-workshop", "publisher_authority": 2, "directness": 2, "temporal_fit": 2, "integrity": 2, "reuse_basis": 2, "rationale": "The workshop report directly enumerates the five cases."}]
    },
    {
      "question_id": "Q06", "language": "en", "stratum": "paraphrase",
      "question": "What shared technical capability underpins most of the top-rated workshop cases?",
      "operator_query": "Natural Language Processing common capability most best top-rated test cases",
      "reference_answer": "Natural Language Processing (NLP).",
      "answerable": true, "temporal_scope": "historical_document", "required_formats": ["docx"],
      "required_sources": ["nasa-ai-strategic-planning-workshop"], "acceptable_sources": ["nasa-ai-strategic-planning-workshop"],
      "support_atoms": [{"atom_id": "A01", "source_key": "nasa-ai-strategic-planning-workshop", "variants": ["Natural Language Processing (NLP) is a common capability found in most of the ”best” (top-rated) test cases", "Natural Language Processing (NLP) is a common capability found in most of the \"best\" (top-rated) test cases"], "required": true}],
      "source_fitness": [{"source_key": "nasa-ai-strategic-planning-workshop", "publisher_authority": 2, "directness": 2, "temporal_fit": 2, "integrity": 2, "reuse_basis": 2, "rationale": "The report's analysis directly identifies NLP."}]
    },
    {
      "question_id": "Q07", "language": "en", "stratum": "direct",
      "question": "What four criteria were used to classify the workshop test cases?",
      "operator_query": "criteria Technical Feasibility Data Availability Sufficiency Explainability Value Customer",
      "reference_answer": "Technical Feasibility; Data Availability and Sufficiency; Explainability; Value to Customer.",
      "answerable": true, "temporal_scope": "historical_document", "required_formats": ["docx"],
      "required_sources": ["nasa-ai-strategic-planning-workshop"], "acceptable_sources": ["nasa-ai-strategic-planning-workshop"],
      "support_atoms": [
        {"atom_id": "A01", "source_key": "nasa-ai-strategic-planning-workshop", "variants": ["Technical Feasibility"], "required": true},
        {"atom_id": "A02", "source_key": "nasa-ai-strategic-planning-workshop", "variants": ["Data Availability and Sufficiency"], "required": true},